{
  "schema_version": "1.0",
  "run_id": "run_bank_20260724_001",
  "session_id": "risk_report_BANK01_2026M06",
  "task_id": "risk_report_BANK01_2026M06_t",
  "run_sequence": 1,
  "supersedes_run_id": null,
  "process_snapshot": {
    "process_id": "monthly_bank_risk_report",
    "version": "1.2.0",
    "digest": "sha256:e668e74d70c3c4c77f5c161d04b219df0b3cbb79d129fc1ed9d663150fec933f",
    "tool_registry_id": "bank_risk_report_mock_tools",
    "tool_registry_version": "1.2.0",
    "tool_registry_digest": "sha256:db898d796ac23cf9b0bcaf56e64ed356ca0de4e0c75491a84c8e923eae429720",
    "profiles": [
      {
        "profile_id": "bank_grounded_risk_narrative",
        "version": "1.0.0",
        "digest": "sha256:33886ab7556702c576e0aa6ca71442a79c7aa6e07da83953f5f9c8ee8bf63f75"
      }
    ]
  },
  "definition_snapshot_ref": "definition/process.snapshot.json",
  "storage_index_ref": "storage-index.json",
  "input_revision_hash": "sha256:bc442e927d94e91d8398630741fbb4a9571fba2f768a449c891a880a948f14fe",
  "status": "completed",
  "outcome": "data_remediation_requested",
  "started_at": "2026-07-24T01:00:00Z",
  "finished_at": "2026-07-24T01:00:59Z",
  "context": {
    "entity_id": "BANK01",
    "period": "2026-06",
    "data_cut_id": "cut-20260723-a",
    "transaction_count_fixture": 128420,
    "payment_count_fixture": 126880,
    "gl_total_fixture": 421500000.25,
    "discrepancy_rate_fixture": 0.12,
    "waiver_decision": "rejected",
    "publish_decision": null,
    "transaction_count": 128420,
    "payment_count": 126880,
    "gl_total": 421500000.25,
    "dq_passed": false,
    "waiver_required": true,
    "dq_accepted": false
  },
  "steps": [
    {
      "step_id": "S1a_freeze_transactions",
      "tool_id": "freeze_transactions",
      "tool_version": "1.0.0",
      "status": "completed",
      "skip_reason": null,
      "attempts": [
        {
          "attempt_id": "sa_f2511a96e3f016c8",
          "attempt_no": 1,
          "status": "completed",
          "operation_idempotency_key": "run_bank_20260724_001:S1a_freeze_transactions:sha256:bc442e927d94e91d8398630741fbb4a9571fba2f768a449c891a880a948f14fe",
          "input_snapshot_hash": "sha256:7fcf02e100a52d473498db7c59bba2fa6545f07f7ef6715d47bfbe78c27896f4",
          "started_at": "2026-07-24T01:00:01Z",
          "finished_at": "2026-07-24T01:00:05Z",
          "metrics": {
            "artifact_count": 1,
            "usage_record_count": 0,
            "fanout_item_count": 0
          },
          "error": null
        }
      ],
      "fanout_items": [],
      "artifact_ids": [
        "art_e041bf3cce805f24"
      ],
      "usage_record_ids": []
    },
    {
      "step_id": "S1b_freeze_payments",
      "tool_id": "freeze_payments",
      "tool_version": "1.0.0",
      "status": "completed",
      "skip_reason": null,
      "attempts": [
        {
          "attempt_id": "sa_4ab12df1ff47e74b",
          "attempt_no": 1,
          "status": "completed",
          "operation_idempotency_key": "run_bank_20260724_001:S1b_freeze_payments:sha256:bc442e927d94e91d8398630741fbb4a9571fba2f768a449c891a880a948f14fe",
          "input_snapshot_hash": "sha256:62d3f1335429c514f8e040161075c095620021c2eaeca635bee9fbba48b21d82",
          "started_at": "2026-07-24T01:00:07Z",
          "finished_at": "2026-07-24T01:00:11Z",
          "metrics": {
            "artifact_count": 1,
            "usage_record_count": 0,
            "fanout_item_count": 0
          },
          "error": null
        }
      ],
      "fanout_items": [],
      "artifact_ids": [
        "art_d9dcb47b28098f78"
      ],
      "usage_record_ids": []
    },
    {
      "step_id": "S1c_freeze_gl",
      "tool_id": "freeze_gl_controls",
      "tool_version": "1.0.0",
      "status": "completed",
      "skip_reason": null,
      "attempts": [
        {
          "attempt_id": "sa_e121b415327eefa1",
          "attempt_no": 1,
          "status": "completed",
          "operation_idempotency_key": "run_bank_20260724_001:S1c_freeze_gl:sha256:bc442e927d94e91d8398630741fbb4a9571fba2f768a449c891a880a948f14fe",
          "input_snapshot_hash": "sha256:8964e5b877c936149a5ccdbcdeacce7c221af48aa1a099d4aca3e9571cfac89f",
          "started_at": "2026-07-24T01:00:13Z",
          "finished_at": "2026-07-24T01:00:17Z",
          "metrics": {
            "artifact_count": 1,
            "usage_record_count": 0,
            "fanout_item_count": 0
          },
          "error": null
        }
      ],
      "fanout_items": [],
      "artifact_ids": [
        "art_32054406dfb37bef"
      ],
      "usage_record_ids": []
    },
    {
      "step_id": "S2_reconcile_quality",
      "tool_id": "reconcile_quality",
      "tool_version": "1.0.0",
      "status": "completed",
      "skip_reason": null,
      "attempts": [
        {
          "attempt_id": "sa_173853c54a506085",
          "attempt_no": 1,
          "status": "completed",
          "operation_idempotency_key": "run_bank_20260724_001:S2_reconcile_quality:sha256:bc442e927d94e91d8398630741fbb4a9571fba2f768a449c891a880a948f14fe",
          "input_snapshot_hash": "sha256:4211a5e27b15f2540a03124ff31ad4cb99b0a2f334ea62c86b956a91580002a3",
          "started_at": "2026-07-24T01:00:19Z",
          "finished_at": "2026-07-24T01:00:25Z",
          "metrics": {
            "artifact_count": 2,
            "usage_record_count": 0,
            "fanout_item_count": 0
          },
          "error": null
        }
      ],
      "fanout_items": [],
      "artifact_ids": [
        "art_6c9c41ddf7c98058",
        "art_4d8329a612ace215"
      ],
      "usage_record_ids": []
    },
    {
      "step_id": "S3_dq_waiver",
      "tool_id": "review_dq_waiver",
      "tool_version": "1.0.0",
      "status": "completed",
      "skip_reason": null,
      "attempts": [
        {
          "attempt_id": "sa_1bf5ac2d17e2a7d5",
          "attempt_no": 1,
          "status": "completed",
          "operation_idempotency_key": "run_bank_20260724_001:S3_dq_waiver:sha256:bc442e927d94e91d8398630741fbb4a9571fba2f768a449c891a880a948f14fe",
          "input_snapshot_hash": "sha256:3a61a2a1c36e77bdb5a9e5fae2121b19f75a5d480cfa83d7bbab3e4552090daa",
          "started_at": "2026-07-24T01:00:27Z",
          "finished_at": "2026-07-24T01:00:36Z",
          "metrics": {
            "artifact_count": 1,
            "usage_record_count": 0,
            "fanout_item_count": 0
          },
          "error": null
        }
      ],
      "fanout_items": [],
      "artifact_ids": [
        "art_ca235cea839dd031"
      ],
      "usage_record_ids": []
    },
    {
      "step_id": "S4_finalize_quality",
      "tool_id": "finalize_quality_decision",
      "tool_version": "1.0.0",
      "status": "completed",
      "skip_reason": null,
      "attempts": [
        {
          "attempt_id": "sa_4ba626c1a18ce637",
          "attempt_no": 1,
          "status": "completed",
          "operation_idempotency_key": "run_bank_20260724_001:S4_finalize_quality:sha256:bc442e927d94e91d8398630741fbb4a9571fba2f768a449c891a880a948f14fe",
          "input_snapshot_hash": "sha256:ee029aaef6eb0cfb7d26fbc22122222367b6e2ec413ecdc2bcbfe57bbaf6a354",
          "started_at": "2026-07-24T01:00:38Z",
          "finished_at": "2026-07-24T01:00:42Z",
          "metrics": {
            "artifact_count": 1,
            "usage_record_count": 0,
            "fanout_item_count": 0
          },
          "error": null
        }
      ],
      "fanout_items": [],
      "artifact_ids": [
        "art_bf1b0f33dd374d52"
      ],
      "usage_record_ids": []
    },
    {
      "step_id": "S5_prepare_dataset",
      "tool_id": "prepare_clean_dataset",
      "tool_version": "1.0.0",
      "status": "skipped",
      "skip_reason": {
        "kind": "when_false",
        "detail": "guard evaluated false (False)"
      },
      "attempts": [],
      "fanout_items": [],
      "artifact_ids": [],
      "usage_record_ids": []
    },
    {
      "step_id": "S6_calculate_metrics",
      "tool_id": "calculate_risk_metrics",
      "tool_version": "1.0.0",
      "status": "skipped",
      "skip_reason": {
        "kind": "dependency_outcome",
        "detail": "all acceptable upstream outcomes are terminal and unreachable"
      },
      "attempts": [],
      "fanout_items": [],
      "artifact_ids": [],
      "usage_record_ids": []
    },
    {
      "step_id": "S7_draft_narrative",
      "tool_id": "draft_grounded_narrative",
      "tool_version": "1.0.0",
      "status": "skipped",
      "skip_reason": {
        "kind": "dependency_outcome",
        "detail": "all acceptable upstream outcomes are terminal and unreachable"
      },
      "attempts": [],
      "fanout_items": [],
      "artifact_ids": [],
      "usage_record_ids": []
    },
    {
      "step_id": "S8_build_appendix",
      "tool_id": "build_compliance_appendix",
      "tool_version": "1.0.0",
      "status": "skipped",
      "skip_reason": {
        "kind": "dependency_outcome",
        "detail": "all acceptable upstream outcomes are terminal and unreachable"
      },
      "attempts": [],
      "fanout_items": [],
      "artifact_ids": [],
      "usage_record_ids": []
    },
    {
      "step_id": "S9_assemble_report",
      "tool_id": "assemble_risk_report",
      "tool_version": "1.0.0",
      "status": "skipped",
      "skip_reason": {
        "kind": "dependency_outcome",
        "detail": "all acceptable upstream outcomes are terminal and unreachable"
      },
      "attempts": [],
      "fanout_items": [],
      "artifact_ids": [],
      "usage_record_ids": []
    },
    {
      "step_id": "S10_report_signoff",
      "tool_id": "review_report_signoff",
      "tool_version": "1.0.0",
      "status": "skipped",
      "skip_reason": {
        "kind": "dependency_outcome",
        "detail": "all acceptable upstream outcomes are terminal and unreachable"
      },
      "attempts": [],
      "fanout_items": [],
      "artifact_ids": [],
      "usage_record_ids": []
    },
    {